{
  "candidate": {
    "kind": "SUBMIT_RESOLUTION",
    "payload": {
      "record": {
        "authority_id": "authority.delegate",
        "authority_proof_digests": [
          "sha256:111da21dcd5fbb1d9d51bea977d06427e6788e58bd02d1701c84ea795f85295e"
        ],
        "basis_digests": [
          "sha256:dddddddddddddddddddddddddddddddddddddddddddddddddddddddddddddddd"
        ],
        "binding_digest": "sha256:beabd05fc065bec06af622d23f9c9e45909c1b9d9970fdecf609d10a5efe8c15",
        "record_digest": "sha256:0de2f1ecfe293f0823d3126396d1480d3e8d022cd7e3745691d3616b4c053a25",
        "request_digest": "sha256:eb016dbdaa1f95ae99f9e0f8dd8dd54865e951e39140e4df2afa3eb0e1b70e92",
        "resolution": "ALLOW",
        "resolution_id": "res.1"
      }
    }
  },
  "case_id": "RES-POS-004",
  "description": "Record ALLOW through one exact-binding Authority grant.",
  "expected": {
    "accepted": true,
    "code": "RESOLUTION_RECORDED",
    "effect_permitted": true,
    "reason": "UNIQUE_VALID_TERMINAL_RECORD",
    "resolution": "ALLOW",
    "state_changed": true
  },
  "initial_store": {
    "authority_bindings": [
      {
        "authority_binding_digest": "sha256:e330f53f77a7adc81a4f37ede069effea59a1267ad4407b3b241bf9ce7b79730",
        "authority_id": "authority.root",
        "binding_digest": "sha256:beabd05fc065bec06af622d23f9c9e45909c1b9d9970fdecf609d10a5efe8c15",
        "constitution_digest": "sha256:9999999999999999999999999999999999999999999999999999999999999999",
        "context_id": "ctx.local",
        "delegation_allowed": true,
        "policy_epoch": 1
      }
    ],
    "authority_grants": [
      {
        "binding_digest": "sha256:beabd05fc065bec06af622d23f9c9e45909c1b9d9970fdecf609d10a5efe8c15",
        "delegation_allowed": false,
        "grant_digest": "sha256:111da21dcd5fbb1d9d51bea977d06427e6788e58bd02d1701c84ea795f85295e",
        "issuer_authority_id": "authority.root",
        "previous_grant_digest": null,
        "subject_authority_id": "authority.delegate"
      }
    ],
    "records": [],
    "requests": []
  },
  "postconditions": [
    {
      "equals": "authority.delegate",
      "path": "/records/0/authority_id"
    }
  ],
  "setup": [
    {
      "kind": "REGISTER_REQUEST",
      "payload": {
        "request": {
          "binding": {
            "binding_digest": "sha256:beabd05fc065bec06af622d23f9c9e45909c1b9d9970fdecf609d10a5efe8c15",
            "context_id": "ctx.local",
            "policy_epoch": 1,
            "question_digest": "sha256:bbbbbbbbbbbbbbbbbbbbbbbbbbbbbbbbbbbbbbbbbbbbbbbbbbbbbbbbbbbbbbbb",
            "scope": [
              "effect:publish"
            ],
            "state_root": "sha256:aaaaaaaaaaaaaaaaaaaaaaaaaaaaaaaaaaaaaaaaaaaaaaaaaaaaaaaaaaaaaaaa"
          },
          "initial_authority_binding_digest": "sha256:e330f53f77a7adc81a4f37ede069effea59a1267ad4407b3b241bf9ce7b79730",
          "previous_terminal_record_digest": null,
          "request_digest": "sha256:eb016dbdaa1f95ae99f9e0f8dd8dd54865e951e39140e4df2afa3eb0e1b70e92",
          "resolution_id": "res.1"
        }
      }
    }
  ]
}
