{
  "candidate": {
    "kind": "EVALUATE_RESOLUTION",
    "payload": {
      "resolution_id": "res.1"
    }
  },
  "case_id": "RES-POS-009",
  "description": "A unique valid ALLOW remains authoritative when additional malformed terminal material is present.",
  "expected": {
    "accepted": true,
    "code": "EVALUATED",
    "effect_permitted": true,
    "reason": "UNIQUE_VALID_TERMINAL_RECORD",
    "resolution": "ALLOW",
    "state_changed": false
  },
  "initial_store": {
    "authority_bindings": [
      {
        "authority_binding_digest": "sha256:da5da8d35eda73a672311a29bd9b27f75127f10d2817cbdb2171edbc7f61fa8f",
        "authority_id": "authority.root",
        "binding_digest": "sha256:beabd05fc065bec06af622d23f9c9e45909c1b9d9970fdecf609d10a5efe8c15",
        "context_id": "ctx.local",
        "policy_epoch": 1
      }
    ],
    "records": [
      {
        "authority_evidence_digests": [],
        "authority_id": "authority.root",
        "basis_digests": [
          "sha256:dddddddddddddddddddddddddddddddddddddddddddddddddddddddddddddddd"
        ],
        "binding_digest": "sha256:beabd05fc065bec06af622d23f9c9e45909c1b9d9970fdecf609d10a5efe8c15",
        "record_digest": "sha256:4f32a4864d57c647b1761a084507ce9c081bc257ac9ba4cd7f066a5598083499",
        "request_digest": "sha256:b4be857c41ad7a5884cde2b5b8e78b6f318d7c3b7f10b28b9fe7974446f7e766",
        "resolution": "ALLOW",
        "resolution_id": "res.1"
      },
      {
        "authority_evidence_digests": [],
        "authority_id": "authority.root",
        "basis_digests": [
          "sha256:dddddddddddddddddddddddddddddddddddddddddddddddddddddddddddddddd"
        ],
        "binding_digest": "sha256:beabd05fc065bec06af622d23f9c9e45909c1b9d9970fdecf609d10a5efe8c15",
        "record_digest": "sha256:ffffffffffffffffffffffffffffffffffffffffffffffffffffffffffffffff",
        "request_digest": "sha256:b4be857c41ad7a5884cde2b5b8e78b6f318d7c3b7f10b28b9fe7974446f7e766",
        "resolution": "ALLOW",
        "resolution_id": "res.1"
      }
    ],
    "requests": [
      {
        "binding": {
          "binding_digest": "sha256:beabd05fc065bec06af622d23f9c9e45909c1b9d9970fdecf609d10a5efe8c15",
          "context_id": "ctx.local",
          "policy_epoch": 1,
          "question_digest": "sha256:bbbbbbbbbbbbbbbbbbbbbbbbbbbbbbbbbbbbbbbbbbbbbbbbbbbbbbbbbbbbbbbb",
          "scope": [
            "effect:publish"
          ],
          "state_root": "sha256:aaaaaaaaaaaaaaaaaaaaaaaaaaaaaaaaaaaaaaaaaaaaaaaaaaaaaaaaaaaaaaaa"
        },
        "initial_authority_binding_digest": "sha256:da5da8d35eda73a672311a29bd9b27f75127f10d2817cbdb2171edbc7f61fa8f",
        "previous_terminal_record_digest": null,
        "request_digest": "sha256:b4be857c41ad7a5884cde2b5b8e78b6f318d7c3b7f10b28b9fe7974446f7e766",
        "resolution_id": "res.1"
      }
    ]
  },
  "postconditions": [],
  "setup": []
}
