{
  "candidate": {
    "kind": "SUBMIT_RESOLUTION",
    "payload": {
      "record": {
        "authority_id": "authority.final",
        "authority_proof_digests": [
          "sha256:4e8eda2117648c7c437e51dec3a6d061d22b2f45c5ef0013b7b3034cced4d449",
          "sha256:7029ae832bea27db5ad915ed05929ec7f81a4fd4d46c11f4dcf3eba352979c42"
        ],
        "basis_digests": [
          "sha256:dddddddddddddddddddddddddddddddddddddddddddddddddddddddddddddddd"
        ],
        "binding_digest": "sha256:beabd05fc065bec06af622d23f9c9e45909c1b9d9970fdecf609d10a5efe8c15",
        "record_digest": "sha256:a78695e21e6466d416e869df4d9a250b07ab0d26667816a0cb4e0cd4e8322c99",
        "request_digest": "sha256:fadf0b74f42e057ea9e55190acf5ac9a222f60688b8514fbaa4ea8826a47d564",
        "resolution": "ALLOW",
        "resolution_id": "res.1"
      }
    }
  },
  "case_id": "RES-POS-005",
  "description": "Record ALLOW through a two-hop attenuating Authority proof.",
  "expected": {
    "accepted": true,
    "code": "RESOLUTION_RECORDED",
    "effect_permitted": true,
    "reason": "UNIQUE_VALID_TERMINAL_RECORD",
    "resolution": "ALLOW",
    "state_changed": true
  },
  "initial_store": {
    "authority_bindings": [
      {
        "authority_binding_digest": "sha256:e330f53f77a7adc81a4f37ede069effea59a1267ad4407b3b241bf9ce7b79730",
        "authority_id": "authority.root",
        "binding_digest": "sha256:beabd05fc065bec06af622d23f9c9e45909c1b9d9970fdecf609d10a5efe8c15",
        "constitution_digest": "sha256:9999999999999999999999999999999999999999999999999999999999999999",
        "context_id": "ctx.local",
        "delegation_allowed": true,
        "policy_epoch": 1
      }
    ],
    "authority_grants": [
      {
        "binding_digest": "sha256:beabd05fc065bec06af622d23f9c9e45909c1b9d9970fdecf609d10a5efe8c15",
        "delegation_allowed": true,
        "grant_digest": "sha256:4e8eda2117648c7c437e51dec3a6d061d22b2f45c5ef0013b7b3034cced4d449",
        "issuer_authority_id": "authority.root",
        "previous_grant_digest": null,
        "subject_authority_id": "authority.delegate"
      },
      {
        "binding_digest": "sha256:beabd05fc065bec06af622d23f9c9e45909c1b9d9970fdecf609d10a5efe8c15",
        "delegation_allowed": false,
        "grant_digest": "sha256:7029ae832bea27db5ad915ed05929ec7f81a4fd4d46c11f4dcf3eba352979c42",
        "issuer_authority_id": "authority.delegate",
        "previous_grant_digest": "sha256:4e8eda2117648c7c437e51dec3a6d061d22b2f45c5ef0013b7b3034cced4d449",
        "subject_authority_id": "authority.final"
      }
    ],
    "records": [],
    "requests": []
  },
  "postconditions": [
    {
      "equals": "authority.final",
      "path": "/records/0/authority_id"
    }
  ],
  "setup": [
    {
      "kind": "REGISTER_REQUEST",
      "payload": {
        "request": {
          "binding": {
            "binding_digest": "sha256:beabd05fc065bec06af622d23f9c9e45909c1b9d9970fdecf609d10a5efe8c15",
            "context_id": "ctx.local",
            "policy_epoch": 1,
            "question_digest": "sha256:bbbbbbbbbbbbbbbbbbbbbbbbbbbbbbbbbbbbbbbbbbbbbbbbbbbbbbbbbbbbbbbb",
            "scope": [
              "effect:publish"
            ],
            "state_root": "sha256:aaaaaaaaaaaaaaaaaaaaaaaaaaaaaaaaaaaaaaaaaaaaaaaaaaaaaaaaaaaaaaaa"
          },
          "initial_authority_binding_digest": "sha256:e330f53f77a7adc81a4f37ede069effea59a1267ad4407b3b241bf9ce7b79730",
          "previous_resolution_id": null,
          "previous_terminal_record_digest": null,
          "request_digest": "sha256:fadf0b74f42e057ea9e55190acf5ac9a222f60688b8514fbaa4ea8826a47d564",
          "resolution_id": "res.1"
        }
      }
    }
  ]
}
